{
  "id": "horror",
  "display_name": "Nightmare",
  "category": "desktop",
  "colors": {
    "background_overlay": [
      5,
      2,
      2,
      255
    ],
    "btn_normal": [
      0,
      0,
      0,
      0
    ],
    "btn_hover": [
      0,
      0,
      0,
      0
    ],
    "btn_locked": [
      0,
      0,
      0,
      0
    ],
    "btn_border_normal": [
      92,
      22,
      22,
      130
    ],
    "btn_border_hover": [
      196,
      28,
      28,
      255
    ],
    "btn_border_locked": [
      0,
      0,
      0,
      0
    ],
    "text_normal": [
      222,
      214,
      202
    ],
    "text_hover": [
      255,
      25,
      25
    ],
    "text_locked": [
      112,
      102,
      102
    ],
    "icon_color": [
      155,
      22,
      22
    ],
    "slider_bg": [
      20,
      5,
      5
    ],
    "row_bg": [
      18,
      10,
      10,
      205
    ],
    "slider_fill": [
      135,
      0,
      0
    ],
    "slider_handle": [
      210,
      30,
      30
    ],
    "scene_border_normal": [
      70,
      15,
      15
    ],
    "scene_border_hover": [
      255,
      30,
      30
    ],
    "scene_overlay_hover": [
      0,
      0,
      0,
      70
    ],
    "scene_overlay_normal": [
      0,
      0,
      0,
      110
    ],
    "lock_text": [
      150,
      5,
      5
    ],
    "btn_glow_color": [
      180,
      0,
      0
    ]
  },
  "layout": {
    "btn_border_radius": 0,
    "btn_width": 150,
    "btn_height": 150,
    "btn_center_x": 640,
    "btn_y_step": 170,
    "btn_border_width": 0,
    "icons_only": true,
    "icon_btn_size": 150,
    "no_btn_bg": true,
    "text_align": "center",
    "slider_height": 24,
    "scene_grid_cols": 3,
    "scene_thumb_w": 320,
    "scene_thumb_h": 180,
    "title_font_size": 48
  },
  "font": {
    "family": null,
    "size_btn": 36,
    "size_label": 18,
    "size_scene": 22,
    "size_lock": 38,
    "bold": true
  },
  "effects": {
    "btn_shadow": false,
    "btn_glow": false,
    "text_shadow": true,
    "text_shadow_offset": [
      2,
      2
    ],
    "text_shadow_color": [
      0,
      0,
      0,
      240
    ],
    "pulse_hover": true,
    "pulse_scale": 1.05,
    "flicker": true,
    "flicker_intensity": 0.15,
    "flicker_speed": 22.0,
    "flashlight_fx": true,
    "flashlight_radius": 300
  },
  "layout_profile": {
    "type": "sparse"
  },
  "motion": {
    "carousel_zoom": 0.08,
    "float_amp": 1.5,
    "magnetic": false,
    "jitter": 1.2,
    "hover": {
      "scale": 1.05,
      "speed": 5.0
    },
    "reduced_motion": {
      "disable": [
        "flicker",
        "fog",
        "jitter",
        "particles",
        "grain"
      ]
    }
  },
  "background": {
    "mode": "fog",
    "fog_color": [
      70,
      40,
      40
    ],
    "vignette": 0.85
  },
  "particles": {
    "type": "dust",
    "density": 26,
    "color": [
      120,
      92,
      92
    ]
  },
  "typography": {
    "display": {
      "family": [
        "Creepster",
        "Times New Roman",
        "serif"
      ],
      "file": "fonts/Creepster-Regular.ttf",
      "bold": true,
      "spacing": 5
    },
    "title": {
      "family": [
        "Creepster",
        "Times New Roman",
        "serif"
      ],
      "file": "fonts/Creepster-Regular.ttf",
      "bold": true,
      "spacing": 4
    },
    "body": {
      "family": [
        "Times New Roman",
        "Georgia",
        "serif"
      ],
      "bold": false
    }
  },
  "decor": {
    "vignette": 0.85,
    "grain": 0.1,
    "candle_glow": true
  },
  "audio_feel": {
    "hover": "miss",
    "click": "found"
  }
}
