{
  "id": "android_std",
  "display_name": "Modern Android",
  "category": "android",

  "colors": {
    "background_overlay":   [ 12,  16,  24, 235],
    "btn_normal":           [ 33, 150, 243, 200],
    "btn_hover":            [ 33, 150, 243, 255],
    "btn_locked":           [ 40,  50,  60],
    "btn_border_normal":    [255, 255, 255,  60],
    "btn_border_hover":     [255, 255, 255, 200],
    "btn_border_locked":    [ 55,  71,  79],
    "text_normal":          [255, 255, 255],
    "text_hover":           [255, 255, 255],
    "text_locked":          [144, 164, 174],
    "icon_color":           [255, 255, 255],
    "slider_bg":            [ 38,  50,  56],
    "row_bg":               [ 26,  32,  40, 195],
    "slider_fill":          [ 33, 150, 243],
    "slider_handle":        [255, 255, 255],
    "scene_border_normal":  [255, 255, 255,  45],
    "scene_border_hover":   [ 33, 150, 243, 255],
    "scene_overlay_hover":  [ 20,  30,  45, 160],
    "scene_overlay_normal": [ 10,  15,  25,  80],
    "lock_text":            [255,  82,  82],
    "btn_glow_color":       [ 33, 150, 243]
  },

  "layout": {
    "btn_border_radius":    24,
    "btn_width":            480,
    "btn_height":           84,
    "btn_center_x":         640,
    "btn_y_step":           110,
    "btn_border_width":     0,
    "icons_only":           true,
    "icon_btn_size":        120,
    "no_btn_bg":            true,
    "slider_height":        32,
    "scene_grid_cols":      2,
    "scene_thumb_w":        520,
    "scene_thumb_h":        292,
    "title_font_size":      46
  },

  "font": {
    "family":               null,
    "size_btn":             34,
    "size_label":           26,
    "size_scene":           28,
    "size_lock":            44,
    "bold":                 true
  },

  "effects": {
    "glass_effect":         true,
    "glass_color":          [255, 255, 255,  25],
    "glass_hover":          [255, 255, 255,  50],
    "btn_shadow":           true,
    "btn_shadow_offset":    [0, 4],
    "btn_shadow_color":     [0, 0, 0, 80],
    "btn_glow":             true,
    "btn_glow_radius":      12,
    "text_shadow":          true,
    "text_shadow_offset":   [0, 2],
    "text_shadow_color":    [0, 0, 0, 100],
    "pulse_hover":          true,
    "pulse_scale":          1.03
  },

  "layout_profile": { "type": "carousel" },

  "motion": {
    "carousel_zoom":   0.18,
    "float_amp":       0.0,
    "magnetic":        false,
    "hover":           { "scale": 1.03, "speed": 8.0 },
    "reduced_motion":  { "disable": [] }
  },

  "background": { "mode": "material" },

  "particles": { "type": "none" },

  "typography": {
    "display": { "family": ["Roboto", "Segoe UI", "Arial", "sans-serif"], "bold": true },
    "title":   { "family": ["Roboto", "Segoe UI", "sans-serif"], "bold": true },
    "body":    { "family": ["Roboto", "Segoe UI", "sans-serif"], "bold": false }
  },

  "decor": {},

  "audio_feel": { "hover": "hover", "click": "click" }
}
